{
  "documents": [
    {
      "bibliography": {
        "authors": [],
        "identifiers": {
          "isbn10": [],
          "isbn13": [],
          "issn": []
        },
        "language": null,
        "provenance": [],
        "publisher": null,
        "title": null
      },
      "commercial_observations": [],
      "document_kind": "article",
      "editorial_review": {
        "authority_basis": {
          "basis": [
            "preuve textuelle locale",
            "limites explicites de la revue"
          ],
          "level": "contextual"
        },
        "domains": [
          "trend_following",
          "market_history"
        ],
        "justification": "Le texte local identifie une étude historique des tendances industrielles ; elle apporte un angle documenté même sans édition commerciale résolue.",
        "limitations": "Aucune correspondance fournisseur acceptée : l'identité commerciale, l'édition et la fraîcheur ne sont pas promues.",
        "method": "lecture du texte local et de la page de titre ; aucune autorité globale",
        "proof": {
          "kind": "manual",
          "reviewer": "codex"
        },
        "review_flags": [
          "little_known_relevant"
        ],
        "reviewed_at": "2026-08-07",
        "reviewer": "codex",
        "status": "reviewed"
      },
      "file_name": "A Century of Profitable Industry Trends Carlo Zarattini Gary Antonacci.pdf",
      "lookup": {
        "authors": [
          "Carlo Zarattini",
          "Gary Antonacci"
        ],
        "document_kind": "article",
        "identifiers": {
          "isbn10": [],
          "isbn13": [],
          "issn": []
        },
        "title": "A Century of Profitable Industry Trends"
      },
      "provider_observations": [
        {
          "candidates": [],
          "observed_at": "2026-08-07T15:11:32+00:00",
          "provider": "google_books",
          "request": {
            "kind": "title_author",
            "query": "intitle:A Century of Profitable Industry Trends inauthor:Carlo Zarattini",
            "url": "https://www.googleapis.com/books/v1/volumes?q=intitle%3AA+Century+of+Profitable+Industry+Trends+inauthor%3ACarlo+Zarattini&maxResults=40&printType=books"
          },
          "status": "succeeded"
        }
      ],
      "resolution": {
        "candidate_id": null,
        "proof": null,
        "status": "no_match"
      },
      "source_sha256": "7a3001e2de57c3e028a5d36bbcfaa7fb773ae3b77a144aaefcd4cc221b1de03d",
      "temporality": {
        "content_revision": null,
        "edition_published": null,
        "work_first_published": null
      }
    },
    {
      "bibliography": {
        "authors": [
          "Marcos Lopez de Prado"
        ],
        "identifiers": {
          "isbn10": [
            "1119482089"
          ],
          "isbn13": [
            "9781119482086",
            "9781119482109",
            "9781119482116"
          ],
          "issn": []
        },
        "language": "en",
        "provenance": [
          {
            "kind": "source_text",
            "locator": {
              "charspan": [
                0,
                22
              ],
              "docling_ref": "#/texts/48",
              "page": 9
            }
          },
          {
            "kind": "source_text",
            "locator": {
              "charspan": [
                0,
                22
              ],
              "docling_ref": "#/texts/49",
              "page": 9
            }
          },
          {
            "kind": "source_text",
            "locator": {
              "charspan": [
                0,
                22
              ],
              "docling_ref": "#/texts/50",
              "page": 9
            }
          },
          {
            "kind": "provider",
            "observed_at": "2026-08-07T15:11:33+00:00",
            "provider": "google_books",
            "resource_id": "oU9KDwAAQBAJ"
          }
        ],
        "publisher": "John Wiley & Sons",
        "title": "Advances in Financial Machine Learning"
      },
      "commercial_observations": [],
      "document_kind": "book",
      "editorial_review": {
        "authority_basis": {
          "basis": [
            "identité d'édition reliée à une preuve Google Books"
          ],
          "level": "domain_specific"
        },
        "domains": [
          "machine_learning",
          "portfolio_management"
        ],
        "justification": "La source est pertinente pour les domaines indiqués par son titre et sa notice ; la pertinence ne vaut pas validation universelle.",
        "limitations": "Aucune mesure empirique ni revue exhaustive des arguments n'est ajoutée à cette étape.",
        "method": "notice bibliographique et lecture du titre ; aucune autorité globale",
        "proof": {
          "kind": "manual",
          "reviewer": "codex"
        },
        "review_flags": [],
        "reviewed_at": "2026-08-07",
        "reviewer": "codex",
        "status": "reviewed"
      },
      "file_name": "Advances in Financial Machine Learning-Wiley (2018).pdf",
      "lookup": {
        "authors": [],
        "document_kind": "book",
        "identifiers": {
          "isbn10": [],
          "isbn13": [
            "9781119482086",
            "9781119482116",
            "9781119482109"
          ],
          "issn": []
        },
        "title": "Advances in Financial Machine Learning-Wiley (2018)"
      },
      "provider_observations": [
        {
          "candidates": [
            {
              "authors": [
                "Marcos Lopez de Prado"
              ],
              "candidate_id": "google_books:oU9KDwAAQBAJ",
              "categories": [
                "Business & Economics"
              ],
              "identifiers": {
                "isbn10": [
                  "1119482089"
                ],
                "isbn13": [
                  "9781119482086"
                ]
              },
              "language": "en",
              "page_count": 406,
              "proof": {
                "kind": "provider",
                "observed_at": "2026-08-07T15:11:33+00:00",
                "provider": "google_books",
                "resource_id": "oU9KDwAAQBAJ"
              },
              "published_date": "2018-02-21",
              "publisher": "John Wiley & Sons",
              "rating": {
                "average": 5.0,
                "count": 1
              },
              "status": "accepted",
              "subtitle": null,
              "title": "Advances in Financial Machine Learning",
              "volume_id": "oU9KDwAAQBAJ"
            }
          ],
          "observed_at": "2026-08-07T15:11:33+00:00",
          "provider": "google_books",
          "request": {
            "kind": "isbn",
            "query": "isbn:9781119482086",
            "url": "https://www.googleapis.com/books/v1/volumes?q=isbn%3A9781119482086&maxResults=40&printType=books"
          },
          "status": "succeeded"
        }
      ],
      "resolution": {
        "candidate_id": "google_books:oU9KDwAAQBAJ",
        "proof": {
          "kind": "provider",
          "match": "exact_isbn",
          "observed_at": "2026-08-07T15:11:33+00:00",
          "provider": "google_books",
          "resource_id": "oU9KDwAAQBAJ"
        },
        "status": "accepted"
      },
      "source_sha256": "5a93ef385b4216c7859bd8e17401195a3aa70f91583f37984f56121e33e93305",
      "temporality": {
        "content_revision": null,
        "edition_published": {
          "precision": "day",
          "proof": {
            "kind": "provider",
            "observed_at": "2026-08-07T15:11:33+00:00",
            "provider": "google_books",
            "resource_id": "oU9KDwAAQBAJ"
          },
          "value": "2018-02-21"
        },
        "work_first_published": null
      }
    },
    {
      "bibliography": {
        "authors": [],
        "identifiers": {
          "isbn10": [],
          "isbn13": [],
          "issn": []
        },
        "language": null,
        "provenance": [],
        "publisher": null,
        "title": null
      },
      "commercial_observations": [],
      "document_kind": "book",
      "editorial_review": {
        "limitations": "Le titre de fichier ne suffit pas à attribuer une autorité éditoriale.",
        "reason": "aucun volume Google Books correspondant ; publication possiblement sans ISBN",
        "reviewed_at": "2026-08-07",
        "reviewer": "codex",
        "status": "not_assessable"
      },
      "file_name": "alpha-trading-profitable-strategies-that-remove-directional-risk-wiley-trading-.pdf",
      "lookup": {
        "authors": [],
        "document_kind": "book",
        "identifiers": {
          "isbn10": [],
          "isbn13": [],
          "issn": []
        },
        "title": "alpha-trading-profitable-strategies-that-remove-directional-risk-wiley-trading-"
      },
      "provider_observations": [
        {
          "candidates": [],
          "observed_at": "2026-08-07T15:11:34+00:00",
          "provider": "google_books",
          "request": {
            "kind": "title_author",
            "query": "intitle:alpha-trading-profitable-strategies-that-remove-directional-risk-wiley-trading-",
            "url": "https://www.googleapis.com/books/v1/volumes?q=intitle%3Aalpha-trading-profitable-strategies-that-remove-directional-risk-wiley-trading-&maxResults=40&printType=books"
          },
          "status": "succeeded"
        }
      ],
      "resolution": {
        "candidate_id": null,
        "proof": null,
        "status": "no_match"
      },
      "source_sha256": "a9458052d3dd31671406eaa75d21e3e7e32cb5817c19d6cafdd1950defcebf11",
      "temporality": {
        "content_revision": null,
        "edition_published": null,
        "work_first_published": null
      }
    },
    {
      "bibliography": {
        "authors": [
          "Matthew R. Kratter"
        ],